{
  "$schema": "http://json-schema.org/draft-07/schema#",
  "type": "array",
  "items": {
    "type": "object",
    "required": ["name", "state", "address", "website"],
    "properties": {
      "name": {
        "type": "string",
        "minLength": 1
      },
      "state": {
        "type": "string",
        "enum": [
          "Alabama", "Alaska", "Arizona", "Arkansas", "California", "Colorado",
          "Connecticut", "Delaware", "Florida", "Georgia", "Hawaii", "Idaho",
          "Illinois", "Indiana", "Iowa", "Kansas", "Kentucky", "Louisiana",
          "Maine", "Maryland", "Massachusetts", "Michigan", "Minnesota",
          "Mississippi", "Missouri", "Montana", "Nebraska", "Nevada",
          "New Hampshire", "New Jersey", "New Mexico", "New York",
          "North Carolina", "North Dakota", "Ohio", "Oklahoma", "Oregon",
          "Pennsylvania", "Rhode Island", "South Carolina", "South Dakota",
          "Tennessee", "Texas", "Utah", "Vermont", "Virginia", "Washington",
          "West Virginia", "Wisconsin", "Wyoming"
        ]
      },
      "address": {
        "type": "string",
        "minLength": 1
      },
      "website": {
        "type": "string",
        "format": "uri"
      },
      "thumbnail": {
        "type": "string"
      }
    },
    "additionalProperties": false
  }
}

