[{
    "name": "Mama Mocha's Coffee Emporium",
    "state": "Alabama",
    "address": "414 S Gay Street Auburn, AL  36830",
    "website": "https://mamamocha.com"
  },
  {
    "name": "The Red Cat Coffeehouse",
    "state": "Alabama",
    "address": "2901 2nd Ave S #120 Birmingham, AL 35233",
    "website": "https://theredcatcoffeehouse.com"
  },
  {
    "name": "Catel Coffee Lab",
    "state": "Arizona",
    "address": "225 W. University Dr, Tempe AZ 85281",
    "website": "https://cartelcoffeelab.com"
  },
  {
    "name": "Provision Coffee",
    "state": "Arizona",
    "address": "4501 N 32nd St, Phoenix, AZ 85018",
    "website": "https://provisioncoffee.com"
  },
  {
    "name": "Nom de Plume Roasters",
    "state": "Arizona",
    "address": "PO Box 169, Phoenix, AZ",
    "website": "https://nomdeplumeroasters.com"
  },
  {
    "name": "Exo Roast",
    "state": "Arizona",
    "address": "403 N 6th Ave Tucson, AZ 85705",
    "website": "https://exocoffee.com"
  },
  {
    "name": "Caffe Luce",
    "state": "Arizona",
    "address": "943 E University Blvd #191, Tucson, AZ 85719",
    "website": "https://caffeluce.com"
  },
  {
    "name": "Cartel Coffee Lab",
    "state": "Arizona",
    "address": "225 W University Dr, Tempe, AZ 85281",
    "website": "https://cartelcoffeelab.com"
  },
  {
    "name": "Altitude Coffee Lab",
    "state": "Arizona",
    "address": "8320 N Hayden Rd #107, Scottsdale, AZ 85258",
    "website": "https://altitudecoffeelab.com"
  },
  {
    "name": "Savaya coffee",
    "state": "Arizona",
    "address": "5350 E Broadway Blvd., Tucson, AZ 85711",
    "website": "https://savayacoffee.com"
  },
  {
    "name": "Late For The Train",
    "state": "Arizona",
    "address": "1071 Old Canyon Ct, Flagstaff, AZ, 86001",
    "website": "https://lateforthetrain.com"
  },
  {
    "name": "Fire Creek Coffee Company",
    "state": "Arizona",
    "address": "22 E. Route 66, Flagstaff, AZ, 86001",
    "website": "https://firecreekcoffee.com"
  },
  {
    "name": "Press Coffee Roasters",
    "state": "Arizona",
    "address": "10443 N. 32nd St, Phoenix, AZ 85028",
    "website": "https://presscoffee.com"
  },
  {
    "name": "Rozark Hills Coffee Roasterie",
    "state": "Arkansas",
    "address": "5898 Arkansas 36, Rose Bud, AR 72137",
    "website": "https://rozark.com"
  },
  {
    "name": "Onyx Coffee Lab",
    "state": "Arkansas",
    "address": "2418 N Gregg Ave, Fayetteville, AR 72701",
    "website": "https://onyxcoffeelab.com"
  },
  {
    "name": "Cat & Cloud",
    "state": "California",
    "address": "3600 Portola Drive Santa Cruz, Ca. 95062",
    "website": "https://catandcloud.com"
  },
  {
    "name": "Chromatic Coffee",
    "state": "California",
    "address": "5237 Stevens Creek Blvd Santa Clara, CA 95051",
    "website": "https://chromaticcoffee.com"
  },
  {
    "name": "Bar Nine Collective",
    "state": "California",
    "address": "3515 Helms Ave  Culver City, CA 90232",
    "website": "https://barninela.com"
  },
  {
    "name": "Dark Horse Coffee Roasters",
    "state": "California",
    "address": "3260 Adams Ave, San Diego, CA 92116",
    "website": "https://darkhorseroasting.com"
  },
  {
    "name": "Roast Co.",
    "state": "California",
    "address": "1552 Beach St, Oakland, CA 94608",
    "website": "https://roastco.com"
  },
  {
    "name": "Naked Coffee",
    "state": "California",
    "address": "3527 Broadway Sacramento, CA 95817",
    "website": "https://NakedCoffee.net"
  },
  {
    "name": "Kean Coffee",
    "state": "California",
    "address": "2043 Westcliff Dr #100, Newport Beach, CA 92660",
    "website": "https://keancoffee.com"
  },
  {
    "name": "Barefoot Coffee Roasters",
    "state": "California",
    "address": "2475 De La Cruz Blvd, Santa Clara, CA 95050",
    "website": "https://barefootcoffee.com"
  },
  {
    "name": "Klatch Coffee",
    "state": "California",
    "address": "806 W Arrow Hwy, San Dimas, CA 91773",
    "website": "https://klatchroasting.com"
  },
  {
    "name": "Café Moto",
    "state": "California",
    "address": "2619 National Ave, San Diego, CA 92113",
    "website": "https://cafemoto.com"
  },
  {
    "name": "The Oaks Gourmet",
    "state": "California",
    "address": "1915 N Bronson Ave, Los Angeles, CA 90068",
    "website": "https://theoaksgourmet.com"
  },
  {
    "name": "Beacon Coffee",
    "state": "California",
    "address": "5777 Olivas Park Dr, Ventura, CA 93003",
    "website": "https://beaconcoffee.com"
  },
  {
    "name": "Temple Coffee Roasters",
    "state": "California",
    "address": "2827 S Street Sacramento, CA 95816",
    "website": "https://templecoffee.com"
  },
  {
    "name": "Rocchio Family Roasters",
    "state": "California",
    "address": "PO Box 3784, Manhattan Beach, CA 90266",
    "website": "https://rocchiocoffee.com"
  },
  {
    "name": "Augies Coffee Roasters",
    "state": "California",
    "address": "113 N 5th St, Redlands, CA 92373",
    "website": "https://augiescoffeehouse.com"
  },
  {
    "name": "Wild Goose Coffee Roasters",
    "state": "California",
    "address": "1670 Sessums Dr, Redlands, CA 92374",
    "website": "https://wildgoosecoffee.com"
  },
  {
    "name": "Zumbar",
    "state": "California",
    "address": "10920 Roselle St, San Diego, CA 92121",
    "website": "https://zumbarcoffee.com"
  },
  {
    "name": "Bird Rock Coffee Roasters",
    "state": "California",
    "address": "5627 La Jolla Blvd, La Jolla, CA 92037",
    "website": "https://birdrockcoffee.com"
  },
  {
    "name": "Andytown Coffee Roasters",
    "state": "California",
    "address": "3655 Lawton St, San Francisco, CA 94122",
    "website": "https://andytownsf.com"
  },
  {
    "name": "Melody Coffee",
    "state": "California",
    "address": "1441 Grove St. Unit E, Healdsburg, CA 95448",
    "website": "https://melodycoffee.com"
  },
  {
    "name": "Taylor Maid Farms Organic Coffee",
    "state": "California",
    "address": "6790 McKinley St #170, Sebastopol CA 95472",
    "website": "https://taylormaidfarms.com"
  },
  {
    "name": "Mr. Espresso",
    "state": "California",
    "address": "696 3rd St, Oakland, CA 94607",
    "website": "https://mrespresso.com"
  },
  {
    "name": "Caroline's Coffee Roasters",
    "state": "California",
    "address": "128 S. Auburn St, Grass Valley, CA 95945",
    "website": "https://carolinescoffee.com"
  },
  {
    "name": "James Coffee Co.",
    "state": "California",
    "address": "2355 India St, San Diego, CA 92101",
    "website": "https://jamescoffeeco.com"
  },
  {
    "name": "Allegro Coffee Company",
    "state": "Colorado",
    "address": "12799 Claude Ct, Thornton, CO 80241",
    "website": "https://allegrocoffee.com"
  },
  {
    "name": "Corvus Coffee Roasters",
    "state": "Colorado",
    "address": "1740 S Broadway Denver, CO 80210",
    "website": "https://corvuscoffee.com"
  },
  {
    "name": "Sweet Bloom Coffee Roasters",
    "state": "Colorado",
    "address": "1619 Reed St Lakewood, CO 80214",
    "website": "https://sweetbloomcoffee.com"
  },
  {
    "name": "Novo Coffee",
    "state": "Colorado",
    "address": "3008 Larimer St. Denver, CO 80205",
    "website": "https://novocoffee.com"
  },
  {
    "name": "High Rise Coffee Roasters",
    "state": "Colorado",
    "address": "2421 W Cucharras St, Colorado Springs, CO 80904",
    "website": "https://springscoffee.com"
  },
  {
    "name": "Proper Grounds",
    "state": "Colorado",
    "address": "990 South Public Road B-3, Lafayette, CO 80026",
    "website": "https://propergroundscoffee.com"
  },
  {
    "name": "Flattop Coffee Roaster",
    "state": "Colorado",
    "address": "N Saint Vrain, Estes Park, CO 80517",
    "website": "https://flattopcoffee.com"
  },
  {
    "name": "Catalina Cafe",
    "state": "Florida",
    "address": "1208 Capital Cir SE, Tallahassee, FL 32301",
    "website": "https://catalinacafe.com"
  },
  {
    "name": "Lucky Goat Coffee",
    "state": "Florida",
    "address": "668 Capital Circle NE, Tallahassee, FL 32301",
    "website": "https://luckygoatcoffee.com"
  },
  {
    "name": "Buddy Brew",
    "state": "Florida",
    "address": "2020 W. Kennedy Blvd. Tampa, FL 33606",
    "website": "https://buddybrew.com"
  },
  {
    "name": "Panther Coffee",
    "state": "Florida",
    "address": "2390 NW 2nd Ave Miami, FL 32317",
    "website": "https://panthercoffee.com"
  },
  {
    "name": "Oceana Coffee Roasters",
    "state": "Florida",
    "address": "221 Old Dixie Hwy Ste 1 Tequesta, FL 33469",
    "website": "https://oceanacoffee.com"
  },
  {
    "name": "Bold Bean Coffee Roasters",
    "state": "Florida",
    "address": "869 Stockton Street, Suite 1-2 Jacksonville, FL 32204",
    "website": "https://boldbeancoffee.com"
  },
  {
    "name": "Cool Beans Coffee Roasters",
    "state": "Georgia",
    "address": "31 Mill St, Marietta GA 30060",
    "website": "https://coolbeanscoffeeroasters.com"
  },
  {
    "name": "Jittery Joes",
    "state": "Georgia",
    "address": "425 Barber Street Athens, GA, 30601",
    "website": "https://jitteryjoes.com"
  },
  {
    "name": "Batdorf & Bronson Coffee Roasters",
    "state": "Washington",
    "address": "200 Market NE, Olympia, WA 98501",
    "website": "https://batdorfcoffee.com"
  },
  {
    "name": "Safehouse Coffee Roasters",
    "state": "Georgia",
    "address": "109 S Hill St, Griffin, GA 30223",
    "website": "https://safehousecoffeeroasters.com"
  },
  {
    "name": "Evans Brothers Coffee",
    "state": "Idaho",
    "address": "524 Church St. Sandpoint, ID 83864",
    "website": "https://evansbrotherscoffee.com"
  },
  {
    "name": "Landgrove Coffee",
    "state": "Idaho",
    "address": "1100 Nora Creek Rd, Troy, ID 83871",
    "website": "https://landgrovecoffee.com"
  },
  {
    "name": "Gaslight Coffee Roasters",
    "state": "Illinois",
    "address": "2385 N Milwaukee Ave, Chicago, IL 60647",
    "website": "https://gaslightcoffeeroasters.com"
  },
  {